{"$schema":"https://json-schema.org/draft/2020-12/schema","$id":"academy-suno://production/contracts/v1/decision-research-registry.schema.json","title":"Academy Suno Decision Research Canonical Registry","type":"object","additionalProperties":false,"required":["schema_version","namespace","canonical_ref_scheme","allocation_policy","records","aliases"],"properties":{"schema_version":{"const":"1.0.0"},"namespace":{"const":"DR"},"canonical_ref_scheme":{"const":"dr://DR-####"},"allocation_policy":{"type":"string","minLength":1},"records":{"type":"array","minItems":1,"items":{"$ref":"#/$defs/Record"}},"aliases":{"type":"array","items":{"$ref":"#/$defs/Alias"}}},"$defs":{"Target":{"type":"object","additionalProperties":false,"required":["canonical_ref","source_path"],"properties":{"canonical_ref":{"type":"string","pattern":"^dr://DR-[0-9]{4}$"},"source_path":{"type":"string","pattern":"^docs/decisions/research/.+\\.md$"}}},"Record":{"type":"object","additionalProperties":false,"required":["canonical_id","canonical_ref","source_path","source_blob_sha","source_state_summary","normalized_status","authority_mode","legacy_refs"],"properties":{"canonical_id":{"type":"string","pattern":"^DR-[0-9]{4}$"},"canonical_ref":{"type":"string","pattern":"^dr://DR-[0-9]{4}$"},"source_path":{"type":"string","pattern":"^docs/decisions/research/.+\\.md$"},"source_blob_sha":{"type":"string","pattern":"^[0-9a-f]{40}$"},"normalized_status":{"enum":["OPEN","EVIDENCE_REQUIRED","RESEARCHING","READY_FOR_DECISION","LOCKED","DEFERRED","REJECTED","SUPERSEDED"]},"authority_mode":{"enum":["SOURCE_WHOLE_RECORD","SOURCE_LOCKED_SUBCLAIMS","NON_BINDING_RESEARCH"]},"legacy_refs":{"type":"array","uniqueItems":true,"items":{"type":"string","minLength":1}},"locked_claim_refs":{"type":"array","uniqueItems":true,"items":{"type":"string","minLength":1}},"notes":{"type":"string"},"source_state_summary":{"type":"string","minLength":1}}},"Alias":{"type":"object","additionalProperties":false,"required":["alias","resolution","targets"],"properties":{"alias":{"type":"string","minLength":1},"resolution":{"enum":["UNIQUE","AMBIGUOUS_REQUIRES_SOURCE"]},"targets":{"type":"array","minItems":1,"items":{"$ref":"#/$defs/Target"}}}}}}
