{"schema_version":"1.0.0","namespace":"DR","canonical_ref_scheme":"dr://DR-####","allocation_policy":"Preserve source files and their historical identifiers. Retain each unique DR-#### when possible; for a collision, the lexicographically first source path retains that canonical number and later colliding/task-local records receive the next unused number above the prior maximum in source-path order. Canonical references are dr://DR-####. Legacy aliases are explicit; an ambiguous alias must fail closed unless the exact source path disambiguates it.","records":[{"canonical_id":"DR-0001","canonical_ref":"dr://DR-0001","source_path":"docs/decisions/research/DR-0001-evidence-cockpit-frontend-api-live-events.md","source_blob_sha":"76156b72a7464c513360f565c4bb1458532b5893","normalized_status":"READY_FOR_DECISION","authority_mode":"SOURCE_LOCKED_SUBCLAIMS","legacy_refs":["DR-0001","W005-T002-A01"],"notes":"Exact D1-D4 LOCK subclaims bind; frontend/editor choices remain pending.","locked_claim_refs":["DR-0001#D1","DR-0001#D2","DR-0001#D3","DR-0001#D4"],"source_state_summary":"MIXED_LOCK_AND_PENDING"},{"canonical_id":"DR-0014","canonical_ref":"dr://DR-0014","source_path":"docs/decisions/research/DR-0014-financial-document-parsing.md","source_blob_sha":"09820e9a7b02e29012c7ba915e85fe11ea3f37eb","normalized_status":"EVIDENCE_REQUIRED","authority_mode":"NON_BINDING_RESEARCH","legacy_refs":["DR-0014","W005-T014-A01"],"notes":"No parser/OCR winner.","source_state_summary":"PENDING_EVIDENCE"},{"canonical_id":"DR-0701","canonical_ref":"dr://DR-0701","source_path":"docs/decisions/research/DR-0701-observability-telemetry-safe-live-evidence.md","source_blob_sha":"a594a4ffb26064eb1eba6ac3ff00a09520d65ebd","normalized_status":"READY_FOR_DECISION","authority_mode":"SOURCE_LOCKED_SUBCLAIMS","legacy_refs":["DR-0701","W005-T007-A01"],"notes":"Only exact source LOCK subclaims bind; backend/sampling/retention remain open.","source_state_summary":"MIXED_LOCK_AND_OPEN"},{"canonical_id":"DR-5008","canonical_ref":"dr://DR-5008","source_path":"docs/decisions/research/DR-5008-deployment-runtime-topology.md","source_blob_sha":"648d5afb488b59832a5e009bc008ea96a86e55d3","normalized_status":"EVIDENCE_REQUIRED","authority_mode":"NON_BINDING_RESEARCH","legacy_refs":["DR-5008","W005-T008-A01"],"notes":"No deployment/runtime winner.","source_state_summary":"NO_OVERALL_PREFERENCE"},{"canonical_id":"DR-5009","canonical_ref":"dr://DR-5009","source_path":"docs/decisions/research/DR-5009-reliability-capacity-recovery-validation.md","source_blob_sha":"f48155ac52a17582d5906a6baf9a7cd50eaa6ee4","normalized_status":"READY_FOR_DECISION","authority_mode":"SOURCE_LOCKED_SUBCLAIMS","legacy_refs":["DR-5009","W005-T008-A01"],"notes":"Validation method may bind where explicitly locked; numeric targets remain open.","source_state_summary":"MIXED_LOCK_AND_OPEN"},{"canonical_id":"DR-5401","canonical_ref":"dr://DR-5401","source_path":"docs/decisions/research/DR-5401-identity-authorization-tenancy.md","source_blob_sha":"cd9e3c1dfa9f01262c059fdfccdf0427d8a3ffc9","normalized_status":"EVIDENCE_REQUIRED","authority_mode":"NON_BINDING_RESEARCH","legacy_refs":["DR-5401","W005-T004-A01"],"notes":"Security invariants do not select an identity vendor.","source_state_summary":"PENDING_EVIDENCE"},{"canonical_id":"DR-5402","canonical_ref":"dr://DR-5402","source_path":"docs/decisions/research/DR-5402-tenant-data-isolation.md","source_blob_sha":"a87196e802b8311447c377b8e38068269c3a0a90","normalized_status":"EVIDENCE_REQUIRED","authority_mode":"NON_BINDING_RESEARCH","legacy_refs":["DR-5402","W005-T004-A01"],"notes":"Data substrate remains evidence-gated.","source_state_summary":"PENDING_EVIDENCE"},{"canonical_id":"DR-5403","canonical_ref":"dr://DR-5403","source_path":"docs/decisions/research/DR-5403-secure-document-object-storage.md","source_blob_sha":"e134b5073c468931c9b3760d72018f9503b15fcc","normalized_status":"EVIDENCE_REQUIRED","authority_mode":"NON_BINDING_RESEARCH","legacy_refs":["DR-5403","W005-T004-A01"],"notes":"Object-store/scanner winner remains evidence-gated.","source_state_summary":"PENDING_EVIDENCE"},{"canonical_id":"DR-5601","canonical_ref":"dr://DR-5601","source_path":"docs/decisions/research/DR-5601-adaptive-runtime-routing-policy.md","source_blob_sha":"ed70aff60a77759f2e5b308546d7f44f544e0cc6","normalized_status":"READY_FOR_DECISION","authority_mode":"SOURCE_LOCKED_SUBCLAIMS","legacy_refs":["DR-5601"],"notes":"Only exact locked policy constraints bind; no provider/model winner.","source_state_summary":"MIXED_LOCK_AND_OPEN"},{"canonical_id":"DR-5602","canonical_ref":"dr://DR-5602","source_path":"docs/decisions/research/DR-5602-provider-model-portfolio.md","source_blob_sha":"d8efe15516d75b60372eab073413f788da3e732d","normalized_status":"EVIDENCE_REQUIRED","authority_mode":"NON_BINDING_RESEARCH","legacy_refs":["DR-5602"],"notes":"Provider/model portfolio remains evidence-gated.","source_state_summary":"PENDING_EVIDENCE"},{"canonical_id":"DR-5909","canonical_ref":"dr://DR-5909","source_path":"docs/decisions/research/DR-5909-cross-cutting-benchmark-methodology.md","source_blob_sha":"8c937400e0a705905425290ea98c93f676e2465d","normalized_status":"READY_FOR_DECISION","authority_mode":"SOURCE_LOCKED_SUBCLAIMS","legacy_refs":["DR-5909"],"notes":"Only exact source LOCK subclaims bind.","source_state_summary":"MIXED_LOCK_AND_OPEN"},{"canonical_id":"DR-5910","canonical_ref":"dr://DR-5910","source_path":"docs/decisions/research/DR-0001-orchestration-durability-runtime.md","source_blob_sha":"09571a488d9db5be2f4f862bc5a8540038b82dc9","normalized_status":"EVIDENCE_REQUIRED","authority_mode":"NON_BINDING_RESEARCH","legacy_refs":["DR-0001","W005-T003-A01"],"notes":"Canonical remap resolves the duplicate legacy DR-0001; runtime remains PENDING_EVIDENCE.","source_state_summary":"PENDING_EVIDENCE"},{"canonical_id":"DR-5911","canonical_ref":"dr://DR-5911","source_path":"docs/decisions/research/W005-T005-eval-tooling.md","source_blob_sha":"27c6f51b7b06d8c61bf062e4d6dac7bc3dd0ba85","normalized_status":"EVIDENCE_REQUIRED","authority_mode":"NON_BINDING_RESEARCH","legacy_refs":["W005-T005-DR02"],"notes":"External eval tooling remains pending.","source_state_summary":"PENDING_EVIDENCE"},{"canonical_id":"DR-5912","canonical_ref":"dr://DR-5912","source_path":"docs/decisions/research/W005-T005-human-calibration-method.md","source_blob_sha":"a099cce006f596c99e7fcb8074cc50f8c93a1b3c","normalized_status":"READY_FOR_DECISION","authority_mode":"SOURCE_LOCKED_SUBCLAIMS","legacy_refs":["W005-T005-DR01"],"notes":"Locked human-calibration method only; the source's NO_PREFERENCE subchoice is not promoted.","locked_claim_refs":["W005-T005-DR01#locked-method"],"source_state_summary":"LOCK_WITH_OPEN_SUBCHOICE"},{"canonical_id":"DR-5913","canonical_ref":"dr://DR-5913","source_path":"docs/decisions/research/W005-T005-model-judge-role.md","source_blob_sha":"752538bf36f3482598a61bc428298c5fe7e962e6","normalized_status":"LOCKED","authority_mode":"SOURCE_LOCKED_SUBCLAIMS","legacy_refs":["W005-T005-DR03"],"notes":"Model judge role remains limited to exact source lock.","locked_claim_refs":["W005-T005-DR03"],"source_state_summary":"LOCK"},{"canonical_id":"DR-5914","canonical_ref":"dr://DR-5914","source_path":"docs/decisions/research/W005-T013-developer-platform.md","source_blob_sha":"8bfaa4dd52c545ba50cc60ff2f4c2a500222294c","normalized_status":"READY_FOR_DECISION","authority_mode":"SOURCE_LOCKED_SUBCLAIMS","legacy_refs":["W005-T013-A01"],"notes":"Exact locked platform invariants bind; unresolved package managers/repository topology remain evidence-gated.","source_state_summary":"MIXED_LOCK_AND_PENDING"}],"aliases":[{"alias":"DR-0001","resolution":"AMBIGUOUS_REQUIRES_SOURCE","targets":[{"canonical_ref":"dr://DR-0001","source_path":"docs/decisions/research/DR-0001-evidence-cockpit-frontend-api-live-events.md"},{"canonical_ref":"dr://DR-5910","source_path":"docs/decisions/research/DR-0001-orchestration-durability-runtime.md"}]},{"alias":"DR-0014","resolution":"UNIQUE","targets":[{"canonical_ref":"dr://DR-0014","source_path":"docs/decisions/research/DR-0014-financial-document-parsing.md"}]},{"alias":"DR-0701","resolution":"UNIQUE","targets":[{"canonical_ref":"dr://DR-0701","source_path":"docs/decisions/research/DR-0701-observability-telemetry-safe-live-evidence.md"}]},{"alias":"DR-5008","resolution":"UNIQUE","targets":[{"canonical_ref":"dr://DR-5008","source_path":"docs/decisions/research/DR-5008-deployment-runtime-topology.md"}]},{"alias":"DR-5009","resolution":"UNIQUE","targets":[{"canonical_ref":"dr://DR-5009","source_path":"docs/decisions/research/DR-5009-reliability-capacity-recovery-validation.md"}]},{"alias":"DR-5401","resolution":"UNIQUE","targets":[{"canonical_ref":"dr://DR-5401","source_path":"docs/decisions/research/DR-5401-identity-authorization-tenancy.md"}]},{"alias":"DR-5402","resolution":"UNIQUE","targets":[{"canonical_ref":"dr://DR-5402","source_path":"docs/decisions/research/DR-5402-tenant-data-isolation.md"}]},{"alias":"DR-5403","resolution":"UNIQUE","targets":[{"canonical_ref":"dr://DR-5403","source_path":"docs/decisions/research/DR-5403-secure-document-object-storage.md"}]},{"alias":"DR-5601","resolution":"UNIQUE","targets":[{"canonical_ref":"dr://DR-5601","source_path":"docs/decisions/research/DR-5601-adaptive-runtime-routing-policy.md"}]},{"alias":"DR-5602","resolution":"UNIQUE","targets":[{"canonical_ref":"dr://DR-5602","source_path":"docs/decisions/research/DR-5602-provider-model-portfolio.md"}]},{"alias":"DR-5909","resolution":"UNIQUE","targets":[{"canonical_ref":"dr://DR-5909","source_path":"docs/decisions/research/DR-5909-cross-cutting-benchmark-methodology.md"}]},{"alias":"W005-T002-A01","resolution":"UNIQUE","targets":[{"canonical_ref":"dr://DR-0001","source_path":"docs/decisions/research/DR-0001-evidence-cockpit-frontend-api-live-events.md"}]},{"alias":"W005-T003-A01","resolution":"UNIQUE","targets":[{"canonical_ref":"dr://DR-5910","source_path":"docs/decisions/research/DR-0001-orchestratio